"cluster","best_match","pct_match","active_determinants","n_active_dets"
"cluster_1","Uninterested",0,"",0
"cluster_2","Fearful",60,"CREDIT SCORE; RISK PROFILE; LEGAL; TRUST; SAFETY; COST-EFFICIENCY; KNOWLEDGE; OWN COMPETENCE; TECHNICAL FIT; SELF-SATISFACTION; COMMITMENT; ADHERENCE; WELLBEING; RECOGNITION; OWN SIGNIFICANCE",15
"cluster_3","Stubborn",20,"PROFITS; CREDIT SCORE; RISK PROFILE; FRUGALITY; COST-EFFICIENCY; KNOWLEDGE; TECHNICAL FIT; SELF-SATISFACTION; ADHERENCE; SUPPORT; SOCIALISING; RECOGNITION; TRENDS; AUTHORITY; OWN SIGNIFICANCE",15
"cluster_4","Early Adopter",31.25,"LEGAL; TRUST; COST-EFFICIENCY; KNOWLEDGE; ENVIRONMENTAL CONCERNS; SELF-SATISFACTION; ADHERENCE; RIGHTS AND DUTIES; PEER-PRESSURE; SOCIALISING; FUN; RECOGNITION; TRENDS; AUTHORITY; OWN SIGNIFICANCE",15
"cluster_5","Careful",42.1052631578947,"PROFITS; RISK PROFILE; LEGAL; SAFETY; COST-EFFICIENCY; OWN COMPETENCE; ENVIRONMENTAL CONCERNS; SELF-SATISFACTION; COMMITMENT; ADHERENCE; AUTARKY; WELLBEING; COZINESS; RIGHTS AND DUTIES; NOVELTY",15
"cluster_6","Homo Economicus",41.1764705882353,"PROFITS; CREDIT SCORE; ADDED VALUE; FRUGALITY; CLIMATE PROTECTION; TRUST; SAFETY; COST-EFFICIENCY; KNOWLEDGE; OWN COMPETENCE; TECHNICAL FIT; ENVIRONMENTAL CONCERNS; AUTARKY; COZINESS; RIGHTS AND DUTIES",15
"cluster_7","Activist",16.6666666666667,"RISK PROFILE; CLIMATE PROTECTION; LEGAL; KNOWLEDGE; OWN COMPETENCE; TECHNICAL FIT; SELF-SATISFACTION; COMMITMENT; AUTARKY; SOCIALISING; AGREEMENT; NOVELTY; TRENDS; OWN SIGNIFICANCE; APPROVAL",15
